Rank;Sourceid;Title;Type;Issn;SJR;SJR Quartile;H index;Total Docs. (2012);Total Docs. (3years);Total Refs.;Total Cites (3years);Citable Docs. (3years);Cites / Doc. (2years);Ref. / Doc.;Country;Region;Publisher;Coverage;Categories
346;21100259574;"VRIPHYS 2009 - 6th Workshop on Virtual Reality Interactions and Physical Simulations";conference and proceedings;"-";0,147;-;4;0;17;0;5;15;0,00;0,00;Switzerland;Western Europe;"";"";"Artificial Intelligence; Modeling and Simulation"
347;19900191835;"Proceedings - 2011 14th IEEE International Symposium on Object/Component/Service-Oriented Real-Time Distributed Computing, ISORC 2011";conference and proceedings;"-";0,146;-;8;0;35;0;28;32;0,80;0,00;United States;Northern America;"";"";"Artificial Intelligence; Computational Theory and Mathematics; Computer Science Applications"
348;19700166806;"CIS 2009 - 2009 International Conference on Computational Intelligence and Security";conference and proceedings;"-";0,145;-;14;0;277;0;114;271;0,00;0,00;United States;Northern America;"";"";"Artificial Intelligence; Computational Theory and Mathematics; Software"
349;21100205906;"CoNLL- 2009: Shared Task - Proceedings of the Thirteenth Conference on Computational Natural Language Learning, CoNLL: Shared Task";conference and proceedings;"-";0,145;-;5;0;9;0;44;8;0,00;0,00;United States;Northern America;"";"";"Artificial Intelligence; Human-Computer Interaction; Linguistics and Language"
350;21100265621;"ESANN 2009 Proceedings, 17th European Symposium on Artificial Neural Networks - Advances in Computational Intelligence and Learning";conference and proceedings;"-";0,145;-;10;0;96;0;36;95;0,00;0,00;United States;Northern America;"";"";"Artificial Intelligence; Information Systems"
351;19900193686;"IEEE SSCI 2011 - Symposium Series on Computational Intelligence - CISched 2011: 2011 IEEE Symposium on Computational Intelligence in Scheduling";conference and proceedings;"-";0,145;-;3;0;10;0;2;9;0,20;0,00;United States;Northern America;"";"";"Artificial Intelligence; Computational Theory and Mathematics; Computer Science Applications"
352;17500154706;"Proceedings of the International Conference on Advanced Geographic Information Systems and Web Services, GEOWS 2009";conference and proceedings;"-";0,145;-;9;0;34;0;20;32;0,00;0,00;Mexico;Latin America;"";"";"Artificial Intelligence; Computational Theory and Mathematics; Information Systems"
353;19700174612;"3rd International Symposium on Intelligent Information Technology and Security Informatics, IITSI 2010";conference and proceedings;"-";0,144;-;11;0;178;0;84;176;0,47;0,00;United States;Northern America;"";"";"Artificial Intelligence; Information Systems"
354;19700182278;"3rd International Workshop on Advanced Computational Intelligence, IWACI 2010";conference and proceedings;"-";0,144;-;9;0;134;0;47;133;0,35;0,00;United States;Northern America;"";"";"Artificial Intelligence; Computational Theory and Mathematics"
355;19900193406;"IEEE SSCI 2011: Symposium Series on Computational Intelligence - EAIS 2011: 2011 IEEE Workshop on Evolving and Adaptive Intelligent Systems";conference and proceedings;"-";0,144;-;5;0;26;0;13;25;0,50;0,00;United States;Northern America;"";"";"Artificial Intelligence; Control and Systems Engineering; Information Systems"
356;21100198438;"International Conference on Intelligent Systems Design and Applications, ISDA";conference and proceedings;"21647143";0,144;-;23;177;237;3102;95;235;0,40;17,53;United States;Northern America;"";"";"Artificial Intelligence; Computer Science Applications; Control and Systems Engineering; Signal Processing"
357;19900191836;"Proceedings - 2011 14th IEEE International Symposium on Object/Component/Service-Oriented Real-Time Distributed Computing Workshops, ISORCW 2011";conference and proceedings;"-";0,144;-;10;0;42;0;21;37;0,50;0,00;United States;Northern America;"";"";"Artificial Intelligence; Computational Theory and Mathematics; Computer Science Applications"
358;19700194008;"Proceedings of the ACM SIGKDD Workshop on Intelligence and Security Informatics 2010, ISI-KDD 2010";conference and proceedings;"-";0,144;-;6;0;11;0;9;10;0,82;0,00;United States;Northern America;"";"";"Artificial Intelligence; Information Systems"
359;21100258738;"Advanced Microsystems for Automotive Applications 2011: Smart Systems for Electric, Safe and Networked Mobility";conference and proceedings;"-";0,143;-;6;0;34;0;23;32;0,68;0,00;Netherlands;Western Europe;"";"";"Artificial Intelligence; Automotive Engineering; Control and Systems Engineering; Safety, Risk, Reliability and Quality"
360;21100195701;"MM'11 - Proceedings of the 2011 ACM Multimedia Conference and Co-Located Workshops - Multimedia in Forensics and Intelligence Workshop, MiFor'11";conference and proceedings;"-";0,143;-;3;0;7;0;4;5;0,57;0,00;United States;Northern America;"";"";"Artificial Intelligence; Computer Graphics and Computer-Aided Design; Computer Vision and Pattern Recognition"
361;20500195145;"Proc.- 2011 IEEE International Conference on HPCC 2011 - 2011 IEEE International Workshop on FTDCS 2011 -Workshops of the 2011 Int. Conf. on UIC 2011- Workshops of the 2011 Int. Conf. ATC 2011";conference and proceedings;"-";0,143;-;17;0;157;0;81;142;0,52;0,00;United States;Northern America;"";"";"Artificial Intelligence; Computer Networks and Communications"
362;21100197996;"Proceedings - 3rd IEEE International Conference on Intelligent Networking and Collaborative Systems, INCoS 2011";conference and proceedings;"-";0,143;-;15;0;164;0;96;155;0,59;0,00;United States;Northern America;"";"";"Artificial Intelligence; Computer Networks and Communications"
363;19400158325;"Proceedings - ISRCS 2009 - 2nd International Symposium on Resilient Control Systems";conference and proceedings;"-";0,143;-;4;0;12;0;10;11;0,00;0,00;United States;Northern America;"";"";"Artificial Intelligence; Electrical and Electronic Engineering; Hardware and Architecture"
364;19400158370;"2009 IEEE-RIVF International Conference on Computing and Communication Technologies: Research, Innovation and Vision for the Future, RIVF 2009";conference and proceedings;"-";0,142;-;8;0;61;0;26;59;0,00;0,00;United States;Northern America;"";"";"Artificial Intelligence; Computer Science Applications; Software"
365;19700166630;"2009 International Conference on Artificial Intelligence and Computational Intelligence, AICI 2009";conference and proceedings;"-";0,142;-;14;0;251;0;85;247;0,00;0,00;United States;Northern America;"";"";"Artificial Intelligence; Computational Theory and Mathematics; Computer Graphics and Computer-Aided Design; Software"
366;19600157017;"2009 International Conference on Intelligent Human-Machine Systems and Cybernetics, IHMSC 2009";conference and proceedings;"-";0,142;-;13;0;243;0;81;239;0,00;0,00;United States;Northern America;"";"";"Artificial Intelligence; Hardware and Architecture; Human-Computer Interaction; Software"
367;19700188218;"Proceedings - International Conference on Technologies and Applications of Artificial Intelligence, TAAI 2010";conference and proceedings;"-";0,142;-;7;0;83;0;41;81;0,49;0,00;United States;Northern America;"";"";"Artificial Intelligence; Computational Theory and Mathematics"
368;19700181007;"Proceedings of 2010 IEEE/ASME International Conference on Mechatronic and Embedded Systems and Applications, MESA 2010";conference and proceedings;"-";0,142;-;12;0;107;0;47;106;0,44;0,00;United States;Northern America;"";"";"Artificial Intelligence; Control and Systems Engineering"
369;19400157253;"Proceedings - 2009 International Symposium on Ubiquitous Virtual Reality, ISUVR 2009";conference and proceedings;"-";0,141;-;7;0;20;0;11;17;0,00;0,00;United States;Northern America;"";"";"Artificial Intelligence; Software"
370;19700167520;"Proceedings - International Conference on Developments in eSystems Engineering, DeSE 2009";conference and proceedings;"-";0,141;-;9;0;72;0;27;70;0,00;0,00;United States;Northern America;"";"";"Artificial Intelligence; Computer Science Applications"
371;19700181229;"2010 IEEE International Conference on Intelligent Systems, IS 2010 - Proceedings";conference and proceedings;"-";0,140;-;10;0;86;0;39;84;0,45;0,00;United States;Northern America;"";"";"Artificial Intelligence; Information Systems"
372;21100496285;"9th US National and 10th Canadian Conference on Earthquake Engineering 2010, Including Papers from the 4th International Tsunami Symposium";conference and proceedings;"-";0,140;-;7;0;172;0;19;169;0,11;0,00;United States;Northern America;"";"";"Artificial Intelligence; Computational Theory and Mathematics; Computer Science Applications; Theoretical Computer Science"
373;24258;"Inteligencia Artificial";journal;"11373601";0,140;Q4;13;12;44;192;22;40;0,33;16,00;Spain;Western Europe;"Asociacion Espanola de Inteligencia Artificial";"2004-2010, 2012-2021";"Artificial Intelligence (Q4); Software (Q4)"
374;21100216911;"International Conference Recent Advances in Natural Language Processing, RANLP";conference and proceedings;"13138502";0,140;-;30;0;223;0;161;218;0,80;0,00;United States;Northern America;"Association for Computational Linguistics (ACL)";"2005-2009, 2011, 2013, 2015, 2017, 2019";"Artificial Intelligence; Computer Science Applications; Electrical and Electronic Engineering; Software"
375;19700182798;"Proceedings - 2010 IEEE 6th International Conference on Intelligent Computer Communication and Processing, ICCP10";conference and proceedings;"-";0,140;-;10;0;73;0;41;71;0,56;0,00;United States;Northern America;"";"";"Artificial Intelligence"
376;5000153105;"Understanding Complex Systems";book series;"18600840";0,140;Q4;32;70;253;3247;64;240;0,23;46,39;Germany;Western Europe;"Springer Verlag";"2006-2021";"Artificial Intelligence (Q4); Computational Mechanics (Q4); Software (Q4)"
377;19400157252;"2009 1st International Conference on Computational Intelligence, Communication Systems and Networks, CICSYN 2009";conference and proceedings;"-";0,139;-;9;0;93;0;47;91;0,00;0,00;United States;Northern America;"";"";"Artificial Intelligence; Computational Theory and Mathematics; Software"
378;19900194820;"IEEE SSCI 2011 - Symposium Series on Computational Intelligence - CIBCB 2011: 2011 IEEE Symposium on Computational Intelligence in Bioinformatics and Computational Biology";conference and proceedings;"-";0,139;-;5;0;27;0;19;26;0,70;0,00;United States;Northern America;"";"";"Artificial Intelligence; Biomedical Engineering; Computational Theory and Mathematics; Health Informatics"
379;19500157409;"IMVIP 2009 - 2009 International Machine Vision and Image Processing Conference";conference and proceedings;"-";0,139;-;8;0;31;0;11;29;0,00;0,00;United States;Northern America;"";"";"Artificial Intelligence; Computer Vision and Pattern Recognition; Software"
380;19900191741;"ISVRI 2011 - IEEE International Symposium on Virtual Reality Innovations 2011, Proceedings";conference and proceedings;"-";0,139;-;9;0;67;0;34;65;0,51;0,00;United States;Northern America;"";"";"Artificial Intelligence; Management of Technology and Innovation"
381;21100293202;"Proceedings of the European Conference on Games-based Learning";conference and proceedings;"20490992";0,139;-;15;84;283;1774;61;275;0,21;21,12;Germany;Western Europe;"";"";"Artificial Intelligence; Computer Graphics and Computer-Aided Design; Computer Networks and Communications; Control and Systems Engineering; Education; E-learning; Human-Computer Interaction; Software"
382;21100205937;"AISB 2011: Human Memory for Artificial Agents";conference and proceedings;"-";0,138;-;2;0;11;0;3;8;0,27;0,00;United Kingdom;Western Europe;"";"";"Artificial Intelligence"
383;19700175812;"Proceedings of the 10th IASTED International Conference on Artificial Intelligence and Applications, AIA 2010";conference and proceedings;"-";0,138;-;6;0;46;0;16;45;0,35;0,00;United States;Northern America;"";"";"Artificial Intelligence; Computer Science Applications"
384;19700175439;"Proceedings of the IASTED International Conference on Artificial Intelligence and Soft Computing, ASC 2009";conference and proceedings;"-";0,138;-;4;0;28;0;9;27;0,00;0,00;United States;Northern America;"";"";"Artificial Intelligence; Computer Science Applications; Software"
385;19900193954;"Proceedings of the International Conference on Complex, Intelligent and Software Intensive Systems, CISIS 2011";conference and proceedings;"-";0,138;-;13;0;121;0;70;110;0,58;0,00;United States;Northern America;"";"";"Artificial Intelligence; Control and Systems Engineering; Software"
386;19400157305;"SIN'09 - Proceedings of the 2nd International Conference on Security of Information and Networks";conference and proceedings;"-";0,138;-;9;0;53;0;26;49;0,00;0,00;United States;Northern America;"";"";"Artificial Intelligence; Computational Theory and Mathematics; Computer Networks and Communications; Software"
387;21100497149;"10th AIAA Aviation Technology, Integration and Operations Conference 2010, ATIO 2010";conference and proceedings;"-";0,137;-;11;0;57;0;60;56;1,05;0,00;United States;Northern America;"";"";"Architecture; Artificial Intelligence; Information Systems and Management"
388;19500157007;"2009 3rd IEEE International Conference on Digital Ecosystems and Technologies, DEST '09";conference and proceedings;"-";0,137;-;13;0;121;0;74;120;0,00;0,00;United States;Northern America;"";"";"Artificial Intelligence; Computer Science Applications; Ecological Modeling; Environmental Engineering"
389;19600161919;"2009 IEEE International Workshop on Robotic and Sensors Environments, ROSE 2009 - Proceedings";conference and proceedings;"-";0,137;-;8;0;32;0;23;30;0,00;0,00;United States;Northern America;"";"";"Artificial Intelligence; Computer Vision and Pattern Recognition; Electrical and Electronic Engineering"
390;17800156709;"2009 IEEE Symposium on Computational Intelligence in Bioinformatics and Computational Biology, CIBCB 2009 - Proceedings";conference and proceedings;"-";0,137;-;7;0;45;0;24;43;0,00;0,00;United States;Northern America;"";"";"Artificial Intelligence; Biochemistry, Genetics and Molecular Biology (miscellaneous); Computational Theory and Mathematics"
391;19700182033;"2010 IEEE International Conference on Automation, Quality and Testing, Robotics, AQTR 2010 - Proceedings";conference and proceedings;"-";0,137;-;11;0;232;0;87;228;0,38;0,00;United States;Northern America;"";"";"Artificial Intelligence; Computer Vision and Pattern Recognition; Control and Systems Engineering"
392;19700173179;"4th International Conference on Quantum, Nano and Micro Technologies, ICQNM 2010";conference and proceedings;"-";0,137;-;3;0;23;0;4;21;0,17;0,00;United States;Northern America;"";"";"Artificial Intelligence; Electrical and Electronic Engineering; Human-Computer Interaction"
393;19600162003;"6th International Conference on Fuzzy Systems and Knowledge Discovery, FSKD 2009";conference and proceedings;"-";0,137;-;14;0;496;0;139;490;0,00;0,00;United States;Northern America;"";"";"Artificial Intelligence; Computational Mathematics; Computational Theory and Mathematics"
394;21100228121;"Belgian/Netherlands Artificial Intelligence Conference";conference and proceedings;"15687805";0,137;-;14;76;268;744;58;265;0,24;9,79;Netherlands;Western Europe;"";"";"Artificial Intelligence; Computer Science Applications; Computer Vision and Pattern Recognition; Electrical and Electronic Engineering; Human-Computer Interaction"
395;21100197515;"International Conference on Control, Automation and Systems";conference and proceedings;"15987833";0,137;-;20;465;380;4804;103;379;0,27;10,33;United States;Northern America;"";"";"Artificial Intelligence; Computer Science Applications; Control and Systems Engineering; Electrical and Electronic Engineering"
396;19700188230;"Proceedings of Special Session - 9th Mexican International Conference on Artificial Intelligence: Advances in Artificial Intelligence and Applications, MICAI 2010";conference and proceedings;"-";0,137;-;5;0;29;0;11;27;0,38;0,00;United States;Northern America;"";"";"Artificial Intelligence; Computer Science Applications"
397;19700176701;"IJCCI 2009 - International Joint Conference on Computational Intelligence, Proceedings";conference and proceedings;"-";0,136;-;7;0;90;0;16;88;0,00;0,00;United States;Northern America;"";"";"Artificial Intelligence; Computational Theory and Mathematics; Software"
398;21100239810;"Proceedings of the 10th International Conference on Cognitive Modeling, ICCM 2010";conference and proceedings;"-";0,136;-;10;0;72;0;41;70;0,57;0,00;United States;Northern America;"";"";"Artificial Intelligence; Modeling and Simulation"
399;19400157402;"Proceedings of the 2009 International Conference on Machine Learning and Cybernetics";conference and proceedings;"-";0,136;-;15;0;330;0;112;327;0,00;0,00;United States;Northern America;"";"";"Artificial Intelligence; Computer Vision and Pattern Recognition; Control and Systems Engineering; Software"
400;21100198520;"Proceedings of the International Conference on Sensing Technology, ICST";conference and proceedings;"21568065";0,136;-;20;151;131;2171;54;130;0,41;14,38;United States;Northern America;"";"";"Artificial Intelligence; Computer Science Applications; Electrical and Electronic Engineering; Signal Processing"
401;19400158909;"10th ACIS Conference on Software Engineering, Artificial Intelligence, Networking and Parallel/Distributed Computing, SNPD 2009, In conjunction with IWEA 2009 and WEACR 2009";conference and proceedings;"-";0,135;-;9;0;109;0;36;106;0,00;0,00;United States;Northern America;"";"";"Artificial Intelligence; Computer Networks and Communications; Hardware and Architecture; Software"
402;21100199764;"Adaptive and Emergent Behaviour and Complex Systems - Proceedings of the 23rd Convention of the Society for the Study of Artificial Intelligence and Simulation of Behaviour, AISB 2009";conference and proceedings;"-";0,135;-;12;0;138;0;35;124;0,00;0,00;United States;Northern America;"";"";"Artificial Intelligence; Modeling and Simulation"
403;27190;"Machine Translation";journal;"09226567, 15730573";0,135;Q4;31;15;44;481;82;41;1,58;32,07;Netherlands;Western Europe;"Springer Netherlands";"1989-2021";"Linguistics and Language (Q3); Artificial Intelligence (Q4); Software (Q4)"
404;19200157030;"Proceedings of AFRIGRAPH 2009: 6th International Conference on Computer Graphics, Virtual Reality, Visualisation and Interaction in Africa";conference and proceedings;"-";0,135;-;4;0;14;0;9;12;0,00;0,00;United States;Northern America;"";"";"Artificial Intelligence; Computational Theory and Mathematics; Computer Vision and Pattern Recognition"
405;19900194827;"Proceedings of CGAMES'2011 USA - 16th International Conference on Computer Games: AI, Animation, Mobile, Interactive Multimedia, Educational and Serious Games";conference and proceedings;"-";0,135;-;10;0;45;0;34;43;0,76;0,00;United States;Northern America;"";"";"Artificial Intelligence; Computer Vision and Pattern Recognition; Human-Computer Interaction; Software"
406;19600162163;"Proceedings - VRCAI 2009: 8th International Conference on Virtual Reality Continuum and its Applications in Industry";conference and proceedings;"-";0,135;-;8;0;70;0;29;68;0,00;0,00;United States;Northern America;"";"";"Artificial Intelligence; Computer Science Applications"
407;19700186925;"ICCAS 2010 - International Conference on Control, Automation and Systems";conference and proceedings;"-";0,134;-;16;0;545;0;176;544;0,32;0,00;United States;Northern America;"";"";"Artificial Intelligence; Control and Systems Engineering"
408;19900193238;"IEEE SSCI 2011 - Symposium Series on Computational Intelligence - SIS 2011: 2011 IEEE Symposium on Swarm Intelligence";conference and proceedings;"-";0,134;-;12;0;34;0;26;33;0,76;0,00;United States;Northern America;"";"";"Artificial Intelligence; Computational Theory and Mathematics; Information Systems"
409;19700182443;"Proceedings of 2010 International Conference on Intelligent Control and Information Processing, ICICIP 2010";conference and proceedings;"-";0,134;-;12;0;308;0;110;305;0,36;0,00;United States;Northern America;"";"";"Artificial Intelligence; Information Systems"
410;19400157267;"Proceedings of the 2009 International Conference on Computational Intelligence and Natural Computing, CINC 2009";conference and proceedings;"-";0,134;-;10;0;267;0;79;264;0,00;0,00;United States;Northern America;"";"";"Artificial Intelligence; Computational Theory and Mathematics; Computer Vision and Pattern Recognition; Software"
411;21100255316;"Proceedings of the 5th Artificial Intelligence and Interactive Digital Entertainment Conference, AIIDE 2009";conference and proceedings;"-";0,134;-;9;0;35;0;25;34;0,00;0,00;United States;Northern America;"";"";"Artificial Intelligence; Visual Arts and Performing Arts"
412;21100496001;"Society for Experimental Mechanics - SEM Annual Conference and Exposition on Experimental and Applied Mechanics 2009";conference and proceedings;"-";0,134;-;7;0;104;0;20;102;0,00;0,00;United States;Northern America;"";"";"Artificial Intelligence; Computational Theory and Mathematics; Information Systems; Software"
413;19700173183;"2009 IEEE/SICE International Symposium on System Integration: SI International 2008 - The 2nd Symposium on System Integration";conference and proceedings;"-";0,133;-;4;0;25;0;11;23;0,00;0,00;United States;Northern America;"";"";"Artificial Intelligence; Computational Theory and Mathematics"
414;19400157526;"2009 Virtual Rehabilitation International Conference, VR 2009";conference and proceedings;"-";0,133;-;11;0;67;0;52;64;0,00;0,00;United States;Northern America;"";"";"Artificial Intelligence; Biomedical Engineering; Software"
415;19500156804;"2nd International Conference on the Applications of Digital Information and Web Technologies, ICADIWT 2009";conference and proceedings;"-";0,133;-;9;0;153;0;40;150;0,00;0,00;United States;Northern America;"";"";"Artificial Intelligence; Computational Theory and Mathematics; Computer Science Applications; Software"
416;21100198235;"ICARA 2011 - Proceedings of the 5th International Conference on Automation, Robotics and Applications";conference and proceedings;"-";0,133;-;12;0;81;0;51;79;0,63;0,00;United States;Northern America;"";"";"Artificial Intelligence; Control and Systems Engineering; Human-Computer Interaction"
417;19400158314;"2009 Chinese Control and Decision Conference, CCDC 2009";conference and proceedings;"-";0,132;-;16;0;1233;0;290;1232;0,00;0,00;United States;Northern America;"";"";"Artificial Intelligence; Computational Theory and Mathematics; Control and Systems Engineering; Electrical and Electronic Engineering"
418;19900192586;"International Journal of Bio-Science and Bio-Technology (discontinued)";journal;"22337849";0,132;Q4;19;36;48;690;28;48;0,49;19,17;Australia;Pacific Region;"Science and Engineering Research Support Society";"2009-2016";"Artificial Intelligence (Q4); Bioengineering (Q4); Biomedical Engineering (Q4); Biotechnology (Q4)"
419;21100220409;"Proceedings of IEEE Workshop on Advanced Robotics and its Social Impacts, ARSO";conference and proceedings;"21627568";0,132;-;17;23;86;311;31;81;0,33;13,52;United States;Northern America;"";"";"Artificial Intelligence; Computer Science Applications; Computer Vision and Pattern Recognition; Electrical and Electronic Engineering"
420;19600157740;"Proceedings of the 5th IEEE International Workshop on Intelligent Data Acquisition and Advanced Computing Systems: Technology and Applications, IDAACS'2009";conference and proceedings;"-";0,132;-;11;0;142;0;42;139;0,00;0,00;United States;Northern America;"";"";"Artificial Intelligence; Computer Science Applications; Software"
421;21100255112;"AP2PS 2011 - 3rd International Conference on Advances in P2P Systems";conference and proceedings;"-";0,131;-;4;0;16;0;5;15;0,31;0,00;United States;Northern America;"";"";"Artificial Intelligence; Information Systems"
422;19900193226;"IEEE SSCI 2011 - Symposium Series on Computational Intelligence - CCMB 2011: 2011 IEEE Symposium on Computational Intelligence, Cognitive Algorithms, Mind, and Brain";conference and proceedings;"-";0,131;-;10;0;26;0;18;25;0,69;0,00;United States;Northern America;"";"";"Artificial Intelligence; Computational Theory and Mathematics; Human-Computer Interaction"
423;19900193693;"Proceedings - 2011 3rd International Conferenceon Games and Virtual Worlds for Serious Applications, VS-Games 2011";conference and proceedings;"-";0,131;-;12;0;45;0;24;43;0,53;0,00;United States;Northern America;"";"";"Artificial Intelligence; Computer Graphics and Computer-Aided Design; Human-Computer Interaction; Software"
424;20300195054;"Proceedings - International Conference on Machine Learning and Cybernetics";conference and proceedings;"2160133X";0,131;-;19;377;359;5312;84;353;0,23;14,09;United States;Northern America;"";"";"Artificial Intelligence; Computational Theory and Mathematics; Computer Networks and Communications; Human-Computer Interaction"
425;19600157743;"Proceedings of the 2009 International Conference on Adaptive and Intelligent Systems, ICAIS 2009";conference and proceedings;"-";0,131;-;7;0;32;0;15;29;0,00;0,00;United States;Northern America;"";"";"Artificial Intelligence; Computer Science Applications; Control and Systems Engineering; Software"
426;21100199746;"Proceedings of the 6th International Conference on the Foundations of Digital Games, FDG 2011";conference and proceedings;"-";0,131;-;16;0;66;0;48;64;0,73;0,00;United States;Northern America;"";"";"Artificial Intelligence; Computer Graphics and Computer-Aided Design; Human-Computer Interaction; Software"
427;19700188244;"Proceedings - VRCAI 2010, ACM SIGGRAPH Conference on Virtual-Reality Continuum and Its Application to Industry";conference and proceedings;"-";0,131;-;8;0;69;0;29;67;0,42;0,00;United States;Northern America;"";"";"Artificial Intelligence; Computer Graphics and Computer-Aided Design; Computer Science Applications; Computer Vision and Pattern Recognition"
